<?xml version="1.0" encoding="UTF-8"?>
<planes xmlns:xsi="http://www.w3.org/2001/XMLSchema-instance"
        xmlns="http://www.example.org/planes"
        xsi:schemaLocation="http://www.example.org/planes planes.xsd">
    <plane id="ID-1">
        <model>F-150</model>
        <origin>France</origin>
        <chars>
            <type>Fighter</type>
            <sits>2</sits>
            <gun>"7.56mm"</gun>
            <airtoairmissiles>20</airtoairmissiles>
            <airtogroundmissiles>10</airtogroundmissiles>
            <radar>true</radar>
        </chars>
        <parameters>
            <length>123123</length>
            <width>123123</width>
            <height>1231231</height>
        </parameters>
        <price>12331</price>
    </plane>
    <plane id="ID-2">
        <model>F-140</model>
        <origin>America</origin>
        <chars>
            <type>Interceptor</type>
            <sits>2</sits>
            <gun>"7.56mm"</gun>
            <airtoairmissiles>20</airtoairmissiles>
            <airtogroundmissiles>10</airtogroundmissiles>
            <radar>false</radar>
        </chars>
        <parameters>
            <length>123</length>
            <width>21312</width>
            <height>2311</height>
        </parameters>
        <price>123122</price>
    </plane>
</planes>